{
  "project": "Autonomous Framework Development",
  "approach": "Research-driven development with validation gates",
  "duration_weeks": 6,
  "duration_hours": "90-120",
  "start_date": "2025-11-11",
  "current_status": {
    "week": 1,
    "phase": "Week 1 Implementation",
    "progress": "Phase 1-3 MVP Complete",
    "updated_at": "2025-11-10T16:00:00Z"
  },
  "weeks": [
    {
      "week": 1,
      "title": "Phase 1-3 MVP",
      "priority": 1,
      "goal": "Build working Phase 1-3 prototype",
      "duration_hours": "10-12",
      "sections": [
        {
          "id": "w1-api-integration",
          "name": "API Integration",
          "note": "reuse from PREVIOUS_WORK",
          "items": [
            {
              "id": "w1-api-001",
              "task": "Copy PREVIOUS_WORK/SCRIPTS/qc_backtest.py to SCRIPTS/",
              "status": "completed",
              "completed_at": "2025-11-10T10:00:00Z",
              "git_commit": "5e37c3f"
            },
            {
              "id": "w1-api-002",
              "task": "Update qc_backtest.py to use iteration_state.json v1.0.0 schema",
              "status": "completed",
              "completed_at": "2025-11-10T10:00:00Z",
              "git_commit": "5e37c3f"
            },
            {
              "id": "w1-api-003",
              "task": "Test HMAC authentication",
              "status": "completed",
              "completed_at": "2025-11-10T10:00:00Z",
              "git_commit": "5e37c3f"
            },
            {
              "id": "w1-api-004",
              "task": "Test project creation API",
              "status": "completed",
              "completed_at": "2025-11-10T10:00:00Z",
              "git_commit": "5e37c3f"
            },
            {
              "id": "w1-api-005",
              "task": "Test file upload API",
              "status": "completed",
              "completed_at": "2025-11-10T10:00:00Z",
              "git_commit": "5e37c3f"
            },
            {
              "id": "w1-api-006",
              "task": "Test backtest execution API",
              "status": "completed",
              "completed_at": "2025-11-10T10:00:00Z",
              "git_commit": "5e37c3f"
            },
            {
              "id": "w1-api-007",
              "task": "Test result parsing",
              "status": "completed",
              "completed_at": "2025-11-10T10:00:00Z",
              "git_commit": "5e37c3f"
            },
            {
              "id": "w1-api-008",
              "task": "Verify error handling",
              "status": "completed",
              "completed_at": "2025-11-10T10:00:00Z",
              "git_commit": "5e37c3f"
            }
          ]
        },
        {
          "id": "w1-qc-init",
          "name": "Slash Command: /qc-init (Phase 1)",
          "items": [
            {
              "id": "w1-init-001",
              "task": "Create .claude/commands/ directory",
              "status": "completed",
              "completed_at": "2025-11-10T11:00:00Z",
              "git_commit": "e9e7dd2"
            },
            {
              "id": "w1-init-002",
              "task": "Create /qc-init command file",
              "status": "completed",
              "completed_at": "2025-11-10T11:00:00Z",
              "git_commit": "e9e7dd2"
            },
            {
              "id": "w1-init-003",
              "task": "Implement hypothesis input prompts (ID, name, description, rationale)",
              "status": "completed",
              "completed_at": "2025-11-10T11:00:00Z",
              "git_commit": "e9e7dd2"
            },
            {
              "id": "w1-init-004",
              "task": "Create iteration_state.json from template_minimal.json",
              "status": "completed",
              "completed_at": "2025-11-10T11:00:00Z",
              "git_commit": "e9e7dd2"
            },
            {
              "id": "w1-init-005",
              "task": "Populate workflow section (session_id, timestamps)",
              "status": "completed",
              "completed_at": "2025-11-10T11:00:00Z",
              "git_commit": "e9e7dd2"
            },
            {
              "id": "w1-init-006",
              "task": "Set autonomy_mode (default: minimal)",
              "status": "completed",
              "completed_at": "2025-11-10T11:00:00Z",
              "git_commit": "e9e7dd2"
            },
            {
              "id": "w1-init-007",
              "task": "Load thresholds from config (or use defaults)",
              "status": "completed",
              "completed_at": "2025-11-10T11:00:00Z",
              "git_commit": "e9e7dd2"
            },
            {
              "id": "w1-init-008",
              "task": "Create git branch: hypotheses/hypothesis-{id}-{name}",
              "status": "completed",
              "completed_at": "2025-11-10T11:00:00Z",
              "git_commit": "e9e7dd2"
            },
            {
              "id": "w1-init-009",
              "task": "Initial commit: research: Initialize hypothesis - {name}",
              "status": "completed",
              "completed_at": "2025-11-10T11:00:00Z",
              "git_commit": "e9e7dd2"
            },
            {
              "id": "w1-init-010",
              "task": "Log decision to decisions_log",
              "status": "completed",
              "completed_at": "2025-11-10T11:00:00Z",
              "git_commit": "e9e7dd2"
            },
            {
              "id": "w1-init-011",
              "task": "Set next_action to /qc-backtest",
              "status": "completed",
              "completed_at": "2025-11-10T11:00:00Z",
              "git_commit": "e9e7dd2"
            },
            {
              "id": "w1-init-012",
              "task": "Test command end-to-end",
              "status": "completed",
              "completed_at": "2025-11-10T12:00:00Z",
              "git_commit": "e9e7dd2"
            }
          ]
        },
        {
          "id": "w1-qc-backtest",
          "name": "Slash Command: /qc-backtest (Phase 2 & 3)",
          "items": [
            {
              "id": "w1-backtest-001",
              "task": "Create /qc-backtest command file",
              "status": "completed",
              "completed_at": "2025-11-10T12:00:00Z",
              "git_commit": "575bbd9"
            },
            {
              "id": "w1-backtest-002",
              "task": "Read iteration_state.json",
              "status": "completed",
              "completed_at": "2025-11-10T12:00:00Z",
              "git_commit": "575bbd9"
            },
            {
              "id": "w1-backtest-003",
              "task": "Validate current phase is research/implementation",
              "status": "completed",
              "completed_at": "2025-11-10T12:00:00Z",
              "git_commit": "575bbd9"
            },
            {
              "id": "w1-backtest-004",
              "task": "Load QuantConnect Skill (if exists)",
              "status": "completed",
              "completed_at": "2025-11-10T12:00:00Z",
              "git_commit": "575bbd9"
            },
            {
              "id": "w1-backtest-005",
              "task": "Generate strategy code from hypothesis",
              "status": "completed",
              "completed_at": "2025-11-10T13:00:00Z",
              "git_commit": "a0be965"
            },
            {
              "id": "w1-backtest-006",
              "task": "Validate implementation (syntax, entry, exit, risk management)",
              "status": "completed",
              "completed_at": "2025-11-10T13:00:00Z",
              "git_commit": "a0be965"
            },
            {
              "id": "w1-backtest-007",
              "task": "Call qc_backtest.py wrapper (create project, upload, run, parse)",
              "status": "completed",
              "completed_at": "2025-11-10T13:00:00Z",
              "git_commit": "a0be965"
            },
            {
              "id": "w1-backtest-008",
              "task": "Update iteration_state.json with project and results",
              "status": "completed",
              "completed_at": "2025-11-10T13:00:00Z",
              "git_commit": "a0be965"
            },
            {
              "id": "w1-backtest-009",
              "task": "Evaluate backtest results (Phase 3 decision logic)",
              "status": "completed",
              "completed_at": "2025-11-10T13:00:00Z",
              "git_commit": "a0be965"
            },
            {
              "id": "w1-backtest-010",
              "task": "Update iteration_state.json with decision",
              "status": "completed",
              "completed_at": "2025-11-10T13:00:00Z",
              "git_commit": "a0be965"
            },
            {
              "id": "w1-backtest-011",
              "task": "Git commit with metrics and decision",
              "status": "completed",
              "completed_at": "2025-11-10T13:00:00Z",
              "git_commit": "a0be965"
            },
            {
              "id": "w1-backtest-012",
              "task": "Test command end-to-end",
              "status": "completed",
              "completed_at": "2025-11-10T13:00:00Z",
              "git_commit": "a0be965"
            }
          ]
        },
        {
          "id": "w1-decision-logic",
          "name": "Decision Logic Implementation",
          "items": [
            {
              "id": "w1-decision-001",
              "task": "Create decision_logic.py module",
              "status": "completed",
              "completed_at": "2025-11-10T14:00:00Z",
              "git_commit": "575bbd9"
            },
            {
              "id": "w1-decision-002",
              "task": "Implement evaluate_backtest() function with 4-tier framework",
              "status": "completed",
              "completed_at": "2025-11-10T14:00:00Z",
              "git_commit": "575bbd9"
            },